[
  {
    "id": "C1-001",
    "category": "C1",
    "question": "根据 GB/T 39786-2021《信息安全技术 信息系统密码应用基本要求》，以下哪项属于《物理和环境安全层》的密码应用要求？",
    "options": {
      "A": "对网络中的敏感数据传输采用密码技术进行加密保护",
      "B": "对重要数据的存储采用密码技术进行加密保护",
      "C": "对密码设备的物理访问进行身份鉴别",
      "D": "对应用软件实体进行数字证书认证"
    },
    "answer": "C",
    "clause": "6.1 物理和环境安全",
    "explanation": "物理层要求主要涉及对物理设施、设备的身份鉴别保护，密码设备物理访问控制属于该层。"
  },
  {
    "id": "C1-002",
    "category": "C1",
    "question": "GB/T 39786-2021 中，\"网络和通信安全层\"要求对网络边界的通信数据做什么处理？",
    "options": {
      "A": "仅做完整性保护，不要求加密",
      "B": "采用国密算法进行机密性和完整性保护",
      "C": "使用 RSA 证书进行通信实体认证",
      "D": "仅在互联网边界做加密，内网不要求"
    },
    "answer": "B",
    "clause": "6.2 网络和通信安全",
    "explanation": "网络通信层要求在网络边界采用符合 GM/T 标准的密码算法同时保护机密性和完整性。"
  },
  {
    "id": "C1-003",
    "category": "C1",
    "question": "SKOD（密码应用安全性评估）四个维度中，哪个维度评估密码算法、密钥长度的合规性？",
    "options": {
      "A": "S — 完备性（Sufficiency）",
      "B": "K — 正确性（Correctness）",
      "C": "O — 有效性（Operability）",
      "D": "D — 合规性（Conformity）"
    },
    "answer": "B",
    "clause": "7 评估方法",
    "explanation": "K（正确性）维度评估密码应用是否正确使用了合规的算法、密钥长度和工作模式。"
  },
  {
    "id": "C1-004",
    "category": "C1",
    "question": "根据 GM/T 0029-2014，签名验签服务器的 SignData 接口返回的签名数据格式是？",
    "options": {
      "A": "原始 64 字节 r||s 拼接",
      "B": "DER 编码的 SEQUENCE { INTEGER r, INTEGER s }",
      "C": "Base64 编码的 PEM 格式",
      "D": "PKCS#1 v1.5 格式"
    },
    "answer": "B",
    "clause": "GM/T 0029-2014 5.3.3",
    "explanation": "GM/T 0029 规定 SignData 返回 DER 编码的 ASN.1 SEQUENCE 结构，内含 r 和 s 两个 INTEGER。"
  },
  {
    "id": "C1-005",
    "category": "C1",
    "question": "GB/T 39786-2021 将信息系统密码应用要求分为几个等级？",
    "options": {
      "A": "2 个等级",
      "B": "3 个等级",
      "C": "4 个等级",
      "D": "5 个等级"
    },
    "answer": "C",
    "clause": "5 密码应用基本要求等级",
    "explanation": "GB/T 39786-2021 按照信息系统安全保护等级定义了四个密码应用等级，对应等保 1-4 级。"
  },
  {
    "id": "C1-006",
    "category": "C1",
    "question": "SM2 数字签��算法中，Z 值的计算需要包含哪些内容（多选，单选请选最完整的答案）？",
    "options": {
      "A": "用户 ID 长度 + 用户 ID + 椭圆曲线参数 + 公钥",
      "B": "仅用户 ID",
      "C": "私钥 + 消息摘要",
      "D": "证书序列号 + 公钥"
    },
    "answer": "A",
    "clause": "GM/T 0009-2012 5.1",
    "explanation": "Z = SM3(entlen || ID || a || b || Gx || Gy || Px || Py)，包含用户 ID 长度（2字节）、用户 ID、曲线参数（a/b/Gx/Gy）和用户公钥（Px/Py）。"
  },
  {
    "id": "C1-007",
    "category": "C1",
    "question": "在密评中，以下哪种情况属于\"不符合项\"（即直接判定不合格）？",
    "options": {
      "A": "系统使用 SM2-256 但密钥长度文档描述有误",
      "B": "系统仍在使用 RSA-1024 进行用户身份认证",
      "C": "数字证书格式使用 X.509 v3",
      "D": "SM4 使用 CBC 模式但 IV 为固定值（已知问题已记录）"
    },
    "answer": "B",
    "clause": "GB/T 39786-2021 附录 A",
    "explanation": "RSA-1024 不符合国密要求的算法标准，属于算法层面的不符合项，直接判定不合格。固定 IV 属于严重问题但可能归为整改项。"
  },
  {
    "id": "C1-008",
    "category": "C1",
    "question": "GM/T 0018-2023 密码设备应用接口中，SDF_GenerateRandom 函数的作用是？",
    "options": {
      "A": "生成 SM2 密钥对",
      "B": "生成符合规范的随机数",
      "C": "初始化密码设备",
      "D": "验证设备身份"
    },
    "answer": "B",
    "clause": "GM/T 0018-2023 7.2.2",
    "explanation": "SDF_GenerateRandom 调用硬件真随机数发生器产生指定长度的随机数，用于密钥生成、IV 等场景。"
  },
  {
    "id": "C1-009",
    "category": "C1",
    "question": "数字信封（Digital Envelope）在 GM/T 体系中，通常用哪种组合方式实现？",
    "options": {
      "A": "SM2 加密消息 + SM3 完整性保护",
      "B": "SM2 加密 SM4 密钥 + SM4-CBC 加密消息",
      "C": "SM4-GCM 单独加密消息",
      "D": "SM9 身份加密"
    },
    "answer": "B",
    "clause": "GM/T 0010-2012",
    "explanation": "数字信封用 SM2 公钥加密随机生成的 SM4 会话密钥，再用 SM4-CBC 加密实际消息，符合 GM/T 0010-2012 规范。"
  },
  {
    "id": "C1-010",
    "category": "C1",
    "question": "TLCP（传输层密码协议）是哪个标准规定的？",
    "options": {
      "A": "GM/T 0024-2014",
      "B": "GB/T 38636-2020",
      "C": "GM/T 0009-2012",
      "D": "GM/T 0029-2014"
    },
    "answer": "B",
    "clause": "GB/T 38636-2020",
    "explanation": "TLCP（Transport Layer Cryptography Protocol，传输层密码协议）由 GB/T 38636-2020 规定，是国密版 TLS，用于 HTTPS 等场景。"
  },
  {
    "id": "C1-011",
    "category": "C1",
    "question": "SM3 哈希算法的输出长度是？",
    "options": {
      "A": "128 位（16 字节）",
      "B": "160 位（20 字节）",
      "C": "256 位（32 字节）",
      "D": "512 位（64 字节）"
    },
    "answer": "C",
    "clause": "GM/T 0004-2012",
    "explanation": "SM3 是 256 位哈希算法，输出 32 字节，与 SHA-256 输出长度相同但设计完全不同。"
  },
  {
    "id": "C1-012",
    "category": "C1",
    "question": "GM/T 0016-2012 中，SKF_VerifyPIN 接口的 PINType 参数值 0x00000001 代表？",
    "options": {
      "A": "管理员 PIN（Admin PIN）",
      "B": "用户 PIN（User PIN）",
      "C": "设备 PIN",
      "D": "容器 PIN"
    },
    "answer": "B",
    "clause": "GM/T 0016-2012 8.5.1",
    "explanation": "USER_TYPE = 0x00000001 为用户 PIN，ADMIN_TYPE = 0x00000000 为管理员 PIN。"
  },
  {
    "id": "C1-013",
    "category": "C1",
    "question": "密评中\"应用和数据安全层\"主要关注什么？",
    "options": {
      "A": "机房和物理设备的安全",
      "B": "应用系统中数据传输和存储的密码保护",
      "C": "网络拓扑和边界防护",
      "D": "密码设备的物理保护"
    },
    "answer": "B",
    "clause": "GB/T 39786-2021 6.4",
    "explanation": "应用和数据安全层要求在应用层面对敏感数据的传输和存储进行密码保护，包括身份认证、数据加密等。"
  },
  {
    "id": "C1-014",
    "category": "C1",
    "question": "SM4 分组密码的分组长度和密钥长度分别是？",
    "options": {
      "A": "64位分组，128位密钥",
      "B": "128位分组，128位密钥",
      "C": "128位分组，256位密钥",
      "D": "256位分组，256位密钥"
    },
    "answer": "B",
    "clause": "GM/T 0002-2012",
    "explanation": "SM4 采用 128 位（16 字节）分组长度和 128 位（16 字节）密钥长度，与 AES-128 分组和密钥长度相同。"
  },
  {
    "id": "C1-015",
    "category": "C1",
    "question": "GM/T 0029-2014 ValidateCert 接口中，返回值 state=0 表示？",
    "options": {
      "A": "证书已吊销",
      "B": "证书状态未知",
      "C": "证书正常有效",
      "D": "证书格式错误"
    },
    "answer": "C",
    "clause": "GM/T 0029-2014 5.2.2",
    "explanation": "GM/T 0029 ValidateCert 响应中 state=0 表示证书正常（Normal），state=1 表示吊销，state=2 表示未知。"
  },
  {
    "id": "C1-016",
    "category": "C1",
    "question": "根据 GB/T 39786-2021，信息系统机房的电子门禁系统应采用密码技术对进出人员进行身份鉴别，这属于哪个安全层的要求？",
    "options": {
      "A": "6.2 网络和通信安全层",
      "B": "6.3 设备和计算安全层",
      "C": "6.1 物理和环境安全层",
      "D": "6.4 应用和数据安全层"
    },
    "answer": "C",
    "clause": "6.1 物理和环境安全",
    "explanation": "机房电子门禁对进出人员的身份鉴别属于物理和环境安全层（6.1）的范畴，该层专门规范对物理空间访问的密码控制要求。"
  },
  {
    "id": "C1-017",
    "category": "C1",
    "question": "密评场景中，对机房视频监控录像数据进行完整性保护（防止篡改），应归属于 GB/T 39786-2021 哪个层次的要求？",
    "options": {
      "A": "6.4 应用和数据安全层",
      "B": "6.1 物理和环境安全层",
      "C": "6.5 密钥管理层",
      "D": "6.3 设备和计算安全层"
    },
    "answer": "B",
    "clause": "6.1 物理和环境安全",
    "explanation": "机房视频监控录像属于物理环境安全管理数据，其完整性保护要求归属于物理和环境安全层（6.1），而非应用层。"
  },
  {
    "id": "C1-018",
    "category": "C1",
    "question": "某系统要求对机房动力环境（温湿度、UPS）监控数据的传输进行机密性保护，该需求对应 GB/T 39786-2021 的哪个安全层？",
    "options": {
      "A": "6.2 网络和通信安全层",
      "B": "6.3 设备和计算安全层",
      "C": "6.4 应用和数据安全层",
      "D": "6.1 物理和环境安全层"
    },
    "answer": "D",
    "clause": "6.1 物理和环境安全",
    "explanation": "机房动力环境监控（温湿度、UPS）属于物理环境管理范畴，其数据传输的密码保护需求归属于物理和环境安全层（6.1）。"
  },
  {
    "id": "C1-019",
    "category": "C1",
    "question": "根据 GB/T 39786-2021，对重要区域物理访问的日志记录进行完整性保护，防止日志被篡改，应归属哪个安全层？",
    "options": {
      "A": "6.4 应用和数据安全层",
      "B": "6.2 网络和通信安全层",
      "C": "6.1 物理和环境安全层",
      "D": "6.3 设备和计算安全层"
    },
    "answer": "C",
    "clause": "6.1 物理和环境安全",
    "explanation": "物理访问日志是物理和环境安全层（6.1）管理的对象，其完整性保护需求归属于该层，而非应用数据层。"
  },
  {
    "id": "C1-020",
    "category": "C1",
    "question": "某银行机房对物理钥匙柜的开锁操作使用智能卡进行身份鉴别，该要求应归属 GB/T 39786-2021 哪个安全层？",
    "options": {
      "A": "6.3 设备和计算安全层",
      "B": "6.1 物理和环境安全层",
      "C": "6.5 密钥管理层",
      "D": "6.4 应用和数据安全层"
    },
    "answer": "B",
    "clause": "6.1 物理和环境安全",
    "explanation": "使用智能卡对物理钥匙柜开锁进行身份鉴别，属于对物理设施访问的身份认证，归属物理和环境安全层（6.1）。"
  },
  {
    "id": "C1-021",
    "category": "C1",
    "question": "某政务系统要求在机房不间断电源（UPS）的远程监控通道上使用 SM4 加密传输管理数据，该要求归属于 GB/T 39786-2021 哪个安全层？",
    "options": {
      "A": "6.2 网络和通信安全层",
      "B": "6.4 应用和数据安全层",
      "C": "6.1 物理和环境安全层",
      "D": "6.3 设备和计算安全层"
    },
    "answer": "C",
    "clause": "6.1 物理和环境安全",
    "explanation": "UPS 远程监控属于机房物理环境管理，其通道加密保护需求归属物理和环境安全层（6.1）而非网络通信层。"
  },
  {
    "id": "C1-022",
    "category": "C1",
    "question": "根据 GB/T 39786-2021，采用 TLCP 协议对跨网络传输的业务数据进行加密，应归属哪个安全层的要求？",
    "options": {
      "A": "6.1 物理和环境安全层",
      "B": "6.4 应用和数据安全层",
      "C": "6.2 网络和通信安全层",
      "D": "6.3 设备和计算安全层"
    },
    "answer": "C",
    "clause": "6.2 网络和通信安全",
    "explanation": "TLCP（传���层密码协议）用于保护网络传输通道，对跨网络业务数据的加密保护属于网络和通信安全层（6.2）。"
  },
  {
    "id": "C1-023",
    "category": "C1",
    "question": "某系统要求在 IPSec VPN 隧道中使用 SM4 对传输数据进行机密性保护，该需求对应 GB/T 39786-2021 的哪个安全层？",
    "options": {
      "A": "6.3 设备和计算安全层",
      "B": "6.2 网络和通信安全层",
      "C": "6.4 应用和数据安全层",
      "D": "6.5 密钥管理层"
    },
    "answer": "B",
    "clause": "6.2 网络和通信安全",
    "explanation": "IPSec VPN 工作在网络层，其使用 SM4 保护传输数据属于网络和通信安全层（6.2）的要求。"
  },
  {
    "id": "C1-024",
    "category": "C1",
    "question": "网络通信实体认证（如 TLS 握手阶段的证书验证）应归属 GB/T 39786-2021 哪个安全层？",
    "options": {
      "A": "6.4 应用和数据安全层",
      "B": "6.5 密钥管理层",
      "C": "6.1 物理和环境安全层",
      "D": "6.2 网络和通信安全层"
    },
    "answer": "D",
    "clause": "6.2 网络和通信安全",
    "explanation": "TLS 握手中的证书验证用于通信实体认证，属于网络协议层的安全机制，归属网络和通信安全层（6.2）。"
  },
  {
    "id": "C1-025",
    "category": "C1",
    "question": "某系统要求在网络传输路径上对数据包进行 SM3 HMAC 完整性校验以防止中间人篡改，该要求属于 GB/T 39786-2021 哪个层次？",
    "options": {
      "A": "6.4 应用和数据安全层",
      "B": "6.3 设备和计算安全层",
      "C": "6.2 网络和通信安全层",
      "D": "6.1 物理和环境安全层"
    },
    "answer": "C",
    "clause": "6.2 网络和通信安全",
    "explanation": "在网络传输路径上对数据包进行完整性校验属于网络层的保护机制，归属网络和通信安全层（6.2）。"
  },
  {
    "id": "C1-026",
    "category": "C1",
    "question": "密评场景中，使用 SSL VPN 设备建立加密隧道保护远程访问通道，该需求对应 GB/T 39786-2021 哪个安全层？",
    "options": {
      "A": "6.1 物理和环境安全层",
      "B": "6.4 应用和数据安全层",
      "C": "6.5 密钥管理层",
      "D": "6.2 网络和通信安全层"
    },
    "answer": "D",
    "clause": "6.2 网络和通信安全",